<?xml version='1.0' encoding='ISO-8859-1' ?>
<!DOCTYPE slmeta SYSTEM "slmeta.dtd" [
 <!ENTITY sign.type '<type type="varchar" colsize="10"/>'>
]>

<slmeta>
  <publishing-project>
    <title>Foo</title>
    <meta-class id="MC-Text">
      <title>Metadata för Textobjekt</title>
      <table>SL_NE_METADATA</table>
      <meta name="animation_req">
        <title>Anim behov</title>
        <type type="integer"/>
      </meta>
      <meta name="resp_expert">
        <title>Ansv. expert</title>
          &sign.type;
      </meta>
    </meta-class>
    <groups>
    </groups>
  </publishing-project>
</slmeta>
